{
    "code": "Alphonic-ARRL1936",
    "title": {
        "en": "American Radio Relay League (1936)"
    },
    "description": "The phonetic alphabet used by the American Radio Relay League in 1936.",
    "source": "http://www.tubebooks.org/Books/arrl_1936.pdf",
    "alphabets": {
        "en": {
            "A": "Able",
            "B": "Boy",
            "C": "Cast",
            "D": "Dog",
            "E": "Easy",
            "F": "Fox",
            "G": "George",
            "H": "Have",
            "I": "Item",
            "J": "Jig",
            "K": "King",
            "L": "Love",
            "M": "Mike",
            "N": "Nan",
            "O": "Oboe",
            "P": "Pup",
            "Q": "Quack",
            "R": "Rot",
            "S": "Sail",
            "T": "Tare",
            "U": "Unit",
            "V": "Vice",
            "W": "Watch",
            "X": "X-ray",
            "Y": "Yoke",
            "Z": "Zed"
        }
    }
}
