{
    "code": "LVMPD",
    "title": {
        "en": "Las Vegas Metropolitan Police Department"
    },
    "description": "The phonetic alphabet used by the Las Vegas Metropolitan Police Department, based on the one created by Association of Public-Safety Communications Officials-International.",
    "source": "https://www.lvmpd.com/en-us/ProtectTheCity/Documents/IDF%20Code%20Card.pdf",
    "alphabets": {
        "en": {
            "A": "Adam",
            "B": "Baker",
            "C": "Charlie",
            "D": "David",
            "E": "Easy",
            "F": "Frank",
            "G": "George",
            "H": "Henry",
            "I": "Ida",
            "J": "John",
            "K": "King",
            "L": "Lincoln",
            "M": "Mary",
            "N": "Nora",
            "O": "Ocean",
            "P": "Paul",
            "Q": "Queen",
            "R": "Robert",
            "S": "Sam",
            "T": "Tom",
            "U": "Union",
            "V": "Victor",
            "W": "William",
            "X": "X-ray",
            "Y": "Yellow",
            "Z": "Zebra"
        }
    }
}
