{
    "code": "UECU1920",
    "title": {
        "en": "Universal Electrical Communications Union (1920)"
    },
    "description": "The phonetic alphabet laid forth in Appendix 14 (International Radiotelephone Procedure) of the Draft of Convention and Regulations put forward by the Universal Electrical Communications Union in 1920.",
    "source": "https://books.google.com/books?id=OVgNAAAAYAAJ&pg=PA101",
    "alphabets": {
        "en": {
            "A": "Argentine",
            "B": "Brussels",
            "C": "Canada",
            "D": "Damascus",
            "E": "Ecuador",
            "F": "France",
            "G": "Greece",
            "H": "Hanover",
            "I": "Italy",
            "J": "Japan",
            "K": "Khartoum",
            "L": "Lima",
            "M": "Madrid",
            "N": "Nancy",
            "O": "Ostend",
            "P": "Paris",
            "Q": "Quebec",
            "R": "Rome",
            "S": "Sardinia",
            "T": "Tokio",
            "U": "Uruguay",
            "V": "Victoria",
            "W": "Washington",
            "X": "Xaintrie",
            "Y": "Yokohama",
            "Z": "Zanzibar"
        },
        "fr": {
            "A": "Argentina",
            "B": "Bruxelles",
            "C": "Canada",
            "D": "Damas",
            "E": "Ecuador",
            "F": "France",
            "G": "Grèce",
            "H": "Hanovre",
            "I": "Italie",
            "J": "Japon",
            "K": "Khartoum",
            "L": "Lima",
            "M": "Madrid",
            "N": "Nancy",
            "O": "Ostende",
            "P": "Paris",
            "Q": "Québec",
            "R": "Rome",
            "S": "Sardaigne",
            "T": "Tokio",
            "U": "Uruguay",
            "V": "Victoria",
            "W": "Washington",
            "X": "Xaintrie",
            "Y": "Yokohama",
            "Z": "Zanzibar"
        }
    }
}
