{
    "code": "NATO",
    "title": {
        "en": [
            "NATO Phonetic Alphabet",
            "International Radiotelephony Spelling Alphabet",
            "ICAO phonetic alphabet"
        ]
    },
    "description": "The most widely used radiotelephone spelling alphabet. It is officially the International Radiotelephony Spelling Alphabet, and also commonly known as the ICAO phonetic alphabet, with a variation officially known as the ITU phonetic alphabet and figure code.",
    "source": "https://www.icao.int/Pages/AlphabetRadiotelephony.aspx",
    "alphabets": {
        "en": {
            "A": "Alfa",
            "B": "Bravo",
            "C": "Charlie",
            "D": "Delta",
            "E": "Echo",
            "F": "Foxtrot",
            "G": "Golf",
            "H": "Hotel",
            "I": "India",
            "J": "Juliett",
            "K": "Kilo",
            "L": "Lima",
            "M": "Mike",
            "N": "November",
            "O": "Oscar",
            "P": "Papa",
            "Q": "Quebec",
            "R": "Romeo",
            "S": "Sierra",
            "T": "Tango",
            "U": "Uniform",
            "V": "Victor",
            "W": "Whiskey",
            "X": "Xray",
            "Y": "Yankee",
            "Z": "Zulu",
            "1": "One",
            "2": "Two",
            "3": "Three",
            "4": "Four",
            "5": "Five",
            "6": "Six",
            "7": "Seven",
            "8": "Eight",
            "9": "Niner",
            "0": "Zero"
        }
    }
}