{
    "code": "Alphonic-APCO1967",
    "title": {
        "en": "Association of Public-Safety Communications Officials-International Project 2 (1967)"
    },
    "description": "The phonetic alphabet developed by the Association of Public-Safety Communications Officials-International in 1967 for use by police departments and emergency service agencies.",
    "source": "https://archive.org/details/nationaltraining025505mbp",
    "alphabets": {
        "en": {
            "A": "Adam",
            "B": "Boy",
            "C": "Charles",
            "D": "David",
            "E": "Edward",
            "F": "Frank",
            "G": "George",
            "H": "Henry",
            "I": "Ida",
            "J": "John",
            "K": "King",
            "L": "Lincoln",
            "M": "Mary",
            "N": "Nora",
            "O": "Ocean",
            "P": "Paul",
            "Q": "Queen",
            "R": "Robert",
            "S": "Sam",
            "T": "Tom",
            "U": "Union",
            "V": "Victor",
            "W": "William",
            "X": "X-ray",
            "Y": "Young",
            "Z": "Zebra",
            "1": "One",
            "2": "Two",
            "3": "Three",
            "4": "Four",
            "5": "Five",
            "6": "Six",
            "7": "Seven",
            "8": "Eight",
            "9": "Nine",
            "0": "Zero"
        }
    }
}
