{
    "code": "IRCC1938",
    "title": {
        "en": "International Radiocommunication Conference (Cairo, 1938)"
    },
    "description": "The phonetic alphabet laid forth in Appendix 14 (Procedure in the Service of Low-Power Mobile Radiotelephone Stations) of the General Radiocommunication Regulations put forward by the International Radiocommunication Conference in 1938.",
    "source": "http://search.itu.int/history/HistoryDigitalCollectionDocLibrary/1.6.48.en.100.pdf",
    "alphabets": {
        "en": {
            "A": "Amsterdam",
            "B": "Baltimore",
            "C": "Casablanca",
            "D": "Danemark",
            "E": "Edison",
            "F": "Florida",
            "G": "Gallipoli",
            "H": "Havana",
            "I": "Italia",
            "J": "Jérusalem",
            "K": "Kilogramme",
            "L": "Liverpool",
            "M": "Madagascar",
            "N": "New-York",
            "O": "Oslo",
            "P": "Paris",
            "Q": "Québec",
            "R": "Roma",
            "S": "Santiago",
            "T": "Tripoli",
            "U": "Upsala",
            "V": "Valencia",
            "W": "Washington",
            "X": "Xanthippe",
            "Y": "Yokohama",
            "Z": "Zürich",
            "0": "Zero",
            "1": "One",
            "2": "Two",
            "3": "Three",
            "4": "Four",
            "5": "Five",
            "6": "Six",
            "7": "Seven",
            "8": "Eight",
            "9": "Nine",
            ",": "Comma",
            "/": "Fraction bar",
            ".": "Full stop",
            "BREAK": "Break signal"
        }
    }
}
