{
    "code": "USAFM245-1941",
    "title": {
        "en": "U.S. Army Field Manual 24-5 (1941-1943)"
    },
    "description": "The phonetic alphabet used by the U.S. Army between 1941 and 1943 according to Field Manual 24-5. This alphabet was used only for joint Army/Navy operations.",
    "source": "https://archive.org/details/Fm24-51942",
    "alphabets": {
        "en": {
            "A": "Afirm",
            "B": "Baker",
            "C": "Cast",
            "D": "Dog",
            "E": "Easy",
            "F": "Fox",
            "G": "George",
            "H": "Hypo",
            "I": "Interrogatory",
            "J": "Jig",
            "K": "King",
            "L": "Love",
            "M": "Mike",
            "N": "Negat",
            "O": "Option",
            "P": "Prep",
            "Q": "Queen",
            "R": "Roger",
            "S": "Sail",
            "T": "Tare",
            "U": "Unit",
            "V": "Victor",
            "W": "William",
            "X": "X-ray",
            "Y": "Yoke",
            "Z": "Zed",
            "1": "One",
            "2": "Two",
            "3": "Three",
            "4": "Four",
            "5": "Five",
            "6": "Six",
            "7": "Seven",
            "8": "Eight",
            "9": "Nine",
            "0": "Zero"
        }
    }
}
