{
    "code": "USJAN1941A",
    "title": {
        "en": "U.S. Joint Army/Navy variant (1941-1943)"
    },
    "description": "An alternate of the phonetic alphabet used by the U.S. Army and Navy from 1941 to 1943.",
    "source": "http://www.bckelk.ukfsn.org/able.html",
    "alphabets": {
        "en": {
            "A": "Able",
            "B": "Baker",
            "C": "Charlie",
            "D": "Dog",
            "E": "Easy",
            "F": "Fox",
            "G": "George",
            "H": "How",
            "I": "Interrogatory",
            "J": "Jig",
            "K": "King",
            "L": "Love",
            "M": "Mike",
            "N": "Nan",
            "O": "Oboe",
            "P": "Peter",
            "Q": "Queen",
            "R": "Roger",
            "S": "Sugar",
            "T": "Tare",
            "U": "Uncle",
            "V": "Victor",
            "W": "William",
            "X": "X-ray",
            "Y": "Yoke",
            "Z": "Zebra",
            "1": "One",
            "2": "Two",
            "3": "Three",
            "4": "Four",
            "5": "Five",
            "6": "Six",
            "7": "Seven",
            "8": "Eight",
            "9": "Nine",
            "0": "Zero"
        }
    }
}
