{
    "code": "Alphonic-CCIR-ICAN1932",
    "title": {
        "en": "General Radiocommunication and Additional Regulations (CCIR/ICAN, 1932)"
    },
    "description": "The phonetic alphabet laid forth in Appendix 12 (Procedure in the service of low-power mobile radiotelephone stations) of the General Radiocommunication  and Additional Regulations put forward by the CCIR/ICAN in 1932.",
    "source": "http://search.itu.int/history/HistoryDigitalCollectionDocLibrary/1.5.48.en.100.pdf",
    "alphabets": {
        "en": {
            "_num_prefix": "As a number",
            "_num_postfix": "As a number",
            "A": "Amsterdam",
            "B": "Baltimore",
            "C": "Casablanca",
            "D": "Danemark",
            "E": "Edison",
            "F": "Florida",
            "G": "Gallipoli",
            "H": "Havana",
            "I": "Italia",
            "J": "Jérusalem",
            "K": "Kilogramme",
            "L": "Liverpool",
            "M": "Madagascar",
            "N": "New York",
            "O": "Oslo",
            "P": "Paris",
            "Q": "Québec",
            "R": "Roma",
            "S": "Santiago",
            "T": "Tripoli",
            "U": "Upsala",
            "V": "Valencia",
            "W": "Washington",
            "X": "Xanthippe",
            "Y": "Yokohama",
            "Z": "Zürich",
            "0": "Zero",
            "1": "One",
            "2": "Two",
            "3": "Three",
            "4": "Four",
            "5": "Five",
            "6": "Six",
            "7": "Seven",
            "8": "Eight",
            "9": "Nine",
            ",": "Comma",
            "/": "Fraction bar"
        }
    }
}
