{
    "code": "CCIR1927",
    "title": {
        "en": "General Radiotelegraph Regulations (1927)",
        "fr": "Réglement général et additionnel des radiocommunications (1927)"
    },
    "description": "The phonetic alphabet laid forth in Appendix 1 (International Radiotelephone Procedure) of the General Radiotelegraph Regulations put forward by the International Radiotelegraph Convention in 1927.",
    "source": "http://handle.itu.int/11.1004/020.1000/1.4",
    "alphabets": {
        "en": {
            "A": "Amsterdam",
            "B": "Baltimore",
            "C": "Canada",
            "D": "Denmark",
            "E": "Eddystone",
            "F": "Francisco",
            "G": "Gibraltar",
            "H": "Hanover",
            "I": "Italy",
            "J": "Jerusalem",
            "K": "Kimberley",
            "L": "Liverpool",
            "M": "Madagascar",
            "N": "Neufchatel",
            "O": "Ontario",
            "P": "Portugal",
            "Q": "Quebec",
            "R": "Rivoli",
            "S": "Santiago",
            "T": "Tokio",
            "U": "Uruguay",
            "V": "Victoria",
            "W": "Washington",
            "X": "Xantippe",
            "Y": "Yokohama",
            "Z": "Zululand"
        },
        "fr": {
            "A": "Amsterdam",
            "B": "Baltimore",
            "C": "Canada",
            "D": "Danemark",
            "E": "Eddiston",
            "F": "Francisco",
            "G": "Gibraltar",
            "H": "Hanovre",
            "I": "Italie",
            "J": "Jérusalem",
            "K": "Kimberley",
            "L": "Liverpool",
            "M": "Madagascar",
            "N": "Neuchâtel",
            "O": "Ontario",
            "P": "Portugal",
            "Q": "Québec",
            "R": "Rivoli",
            "S": "Santiago",
            "T": "Tokio",
            "U": "Uruguay",
            "V": "Victoria",
            "W": "Washington",
            "X": "Xanthippe",
            "Y": "Yokohama",
            "Z": "Zoulouland"
        }
    }
}
