{
    "code": "Alphonic-IRC1947",
    "title": {
        "en": "Radio Regulations and Additional Radio Regulations (Atlantic City, 1947)",
        "fr": "Réglement et réglement additionnel des radiocommunications (Atlantic City, 1947)",
        "es": "Reglamento y Reglamento Adicional de Radiocomunicaciones (Atlantic City, 1947)",
        "zh": "無線電法規和附加無線電法規（一九四七年，大西洋城）"
    },
    "description": "The phonetic alphabet laid forth in Appendix 11 (Procedure in the Mobile Radiotelephone Service) of the Radio Regulations put forward by the International Radio Conference in Atlantic City, 1947.",
    "source": "http://handle.itu.int/11.1004/020.1000/4.62",
    "alphabets": {
        "en": {
            "A": "Amsterdam",
            "B": "Baltimore",
            "C": "Casablanca",
            "D": "Danemark",
            "E": "Edison",
            "F": "Florida",
            "G": "Gallipoli",
            "H": "Havana",
            "I": "Italia",
            "J": "Jerusalem",
            "K": "Kilogramme",
            "L": "Liverpool",
            "M": "Madagascar",
            "N": "New York",
            "O": "Oslo",
            "P": "Paris",
            "Q": "Quebec",
            "R": "Roma",
            "S": "Santiago",
            "T": "Tripoli",
            "U": "Upsala",
            "V": "Valencia",
            "W": "Washington",
            "X": "Xantippe",
            "Y": "Yokohama",
            "Z": "Zurich",
            "1": "One",
            "2": "Two",
            "3": "Three",
            "4": "Four",
            "5": "Five",
            "6": "Six",
            "7": "Seven",
            "8": "Eight",
            "9": "Nine",
            "0": "Zero",
            ",": "Comma",
            "/": "Fraction bar",
            "BREAK": "Break signal",
            ".": "Period"
        },
        "fr": {
            "A": "Amsterdam",
            "B": "Baltimore",
            "C": "Casablanca",
            "D": "Danemark",
            "E": "Edison",
            "F": "Florida",
            "G": "Gallipoli",
            "H": "Havana",
            "I": "Italia",
            "J": "Jérusalem",
            "K": "Kilogramme",
            "L": "Liverpool",
            "M": "Madagascar",
            "N": "New York",
            "O": "Oslo",
            "P": "Paris",
            "Q": "Québec",
            "R": "Roma",
            "S": "Santiago",
            "T": "Tripoli",
            "U": "Upsala",
            "V": "Valencia",
            "W": "Washington",
            "X": "Xantippe",
            "Y": "Yokohama",
            "Z": "Zurich",
            "1": "Une",
            "2": "Deux",
            "3": "Trois",
            "4": "Quatre",
            "5": "Cinq",
            "6": "Six",
            "7": "Sept",
            "8": "Huit",
            "9": "Neuf",
            "0": "Zéro",
            ",": "Virgule",
            "/": "Barre de fraction",
            "BREAK": "Signal séparatif",
            ".": "Point"
        },
        "es": {
            "A": "Amsterdam",
            "B": "Baltimore",
            "C": "Casablanca",
            "D": "Dinamarca",
            "E": "Edison",
            "F": "Florida",
            "G": "Gallípoli",
            "H": "Habana",
            "I": "Italia",
            "J": "Jerusalén",
            "K": "Kilogramo",
            "L": "Liverpool",
            "M": "Madagascar",
            "N": "Nueva York",
            "O": "Oslo",
            "P": "París",
            "Q": "Quebec",
            "R": "Roma",
            "S": "Santiago",
            "T": "Trípoli",
            "U": "Upsala",
            "V": "Valencia",
            "W": "Wáshington",
            "X": "Xantippe",
            "Y": "Yokohama",
            "Z": "Zurich",
            "1": "Uno",
            "2": "Dos",
            "3": "Tres",
            "4": "Cuatro",
            "5": "Cinco",
            "6": "Seis",
            "7": "Siete",
            "8": "Ocho",
            "9": "Nueve",
            "0": "Cero",
            ",": "Coma",
            "/": "Barra de fracción",
            "BREAK": "Señal de separación",
            ".": "Punto"
        },
        "zh_HANT": {
            "A": "Amsterdam",
            "B": "Baltimore",
            "C": "Casablanca",
            "D": "Danemark",
            "E": "Edison",
            "F": "Florida",
            "G": "Gallipoli",
            "H": "Havana",
            "I": "Italia",
            "J": "Jerusalem",
            "K": "Kilogramme",
            "L": "Liverpool",
            "M": "Madagascar",
            "N": "New York",
            "O": "Oslo",
            "P": "Paris",
            "Q": "Quebec",
            "R": "Roma",
            "S": "Santiago",
            "T": "Tripoli",
            "U": "Upsala",
            "V": "Valencia",
            "W": "Washington",
            "X": "Xantippe",
            "Y": "Yokohama",
            "Z": "Zurich",
            "1": "One",
            "2": "Two",
            "3": "Three",
            "4": "Four",
            "5": "Five",
            "6": "Six",
            "7": "Seven",
            "8": "Eight",
            "9": "Nine",
            "0": "Zero",
            ",": "進點",
            "/": "分數针劃",
            "BREAK": "TODO_BREAK",
            ".": "TODO_POINT"
        }
    }
}
